{
    "$schema": "http://json-schema.org/draft-07/schema#",
    "title": "Task schema",
    "description": "This schema attempts to validate if the basic task JSONs uploaded by experimenters",
    "type": "object",
    "properties":
        {
        "instructions": {"type": "array", "items": {"type": "string"}},
        "feedback": {"type": "boolean"},
        "serveraudio": {"type": "boolean"},
        "trials": 
            {
            "type": "array", 
            "items":
                {
                "type": "object",
                "properties":
                    {
                    "prompt": {"type": "string"},
                    "choices":
                        {
                        "type": "array",
                        "items":
                            {
                            "type": "string",
                            "minItems": 1,
                            "uniqueItems": true
                            }
                        },
                    "stimulus": {"type": "string", "pattern": "(wav)$"},
                    "answer": {"type": "integer", "minimum": 1}
                    }
                },
            "minItems": 1
            }
        },
    "required": ["instructions", "feedback", "serveraudio", "trials"],
    "additionalProperties": false
}