{
	"instructions": ["Wear Headphones", "Do Task"],
	"feedback": true,
	"serveraudio": true,
	"trials":[
		{
		"prompt": "Select one of the three options",
		"choices": ["FIRST", "SECOND", "THIRD"],
		"stimulus": "url1.wav",
		"answer": 1
		},
		{
		"prompt": "Select one of the four options",
		"choices": ["FIRST", "SECOND", "THIRD", "FOURTH"],
		"stimulus": "url2.wav",
		"answer": 2
		},
		{
		"prompt": "Select one of the six options",
		"choices": ["FIRST", "SECOND", "THIRD", "FOURTH",
			"FIFTH", "SIXTH"],
		"stimulus": "url3.wav",
		"answer": 3
		}
	]
}